{
  "schema_version": "release-manifest-1",
  "release_sequence": 99,
  "release_id": "v0.1.0-test.99",
  "version": "0.1.0-test.99",
  "channel": "nightly",
  "published_at": "2026-10-29T15:02:57Z",
  "source_commit": "3336fc89734eb60377f2f26ff7d6a016b16c9254",
  "api_contract_version": "v1",
  "target_migration_version": "104_one_shot_false_block_resume",
  "required_downtime": true,
  "backup_required": true,
  "rollback_class": "restore_required",
  "migrations": [
    {
      "id": "001_baseline.sql",
      "checksum": "f0b2505e38f949c8e2ccda581a429a41fe6a08f86003f2e8f31d3e9a172722fb",
      "reversible": false,
      "compatibility": "forward-only"
    },
    {
      "id": "002_receipt_reserve_version_object_closure.sql",
      "checksum": "e8b0c7a807e139dd318d9b58c2e15e0f914a5bbc06bdb2a5c98f0f1ae573e4da",
      "reversible": false,
      "compatibility": "forward-only"
    },
    {
      "id": "003_receipt_object_nested_closure.sql",
      "checksum": "ed6e6bd29e557b1c88c293eda8289990181d591f587e0b460e645a4a5c642052",
      "reversible": false,
      "compatibility": "forward-only"
    },
    {
      "id": "004_filefact_source_group_relation.sql",
      "checksum": "9d81709a0063a6b34d02fb308cacef8ee0a12ff48bd57215205bbedf8676067c",
      "reversible": false,
      "compatibility": "forward-only"
    },
    {
      "id": "005_anime_metadata_media_kind_override.sql",
      "checksum": "4a6b1004f6af5117ac46a2f3fa101c68d5d19dbe1b7167c37c3f87f125e00532",
      "reversible": false,
      "compatibility": "forward-only"
    },
    {
      "id": "006_group_dictionary.sql",
      "checksum": "e46c7bfb7219b05bcd4bc3e82e8e48e4f70db63bed897a8eaf495a23079a3d32",
      "reversible": false,
      "compatibility": "forward-only"
    },
    {
      "id": "007_metadata_work_titles_tmdb_title_cn.sql",
      "checksum": "83fee8f4e17cc095580001d6941f9bad7ca69f5cbc5af8f16e3c6eadd93cd63f",
      "reversible": false,
      "compatibility": "forward-only"
    },
    {
      "id": "008_managed_anime_provider_title.sql",
      "checksum": "56cbbaeb02f44c61d6d79375f8d48a130918404279362267854ec53779bf78f2",
      "reversible": false,
      "compatibility": "forward-only"
    },
    {
      "id": "009_file_manager_without_root.sql",
      "checksum": "a387ba2bebf49dd19344c6616af768a3c13bfeec14393c109fdc8bfcbf6f12bf",
      "reversible": false,
      "compatibility": "forward-only"
    },
    {
      "id": "010_no_configured_library_root.sql",
      "checksum": "68ce18840184ebaac9e64d8f4a8734bd9f424aaa57140dcfbe52af99005d9633",
      "reversible": false,
      "compatibility": "forward-only"
    },
    {
      "id": "011_metadata_work_titles_year.sql",
      "checksum": "8c89cca96e59b357372286fedd7adfecb4ee360981ded6ee71d84aad7fd9371e",
      "reversible": false,
      "compatibility": "forward-only"
    },
    {
      "id": "012_parser_policy_regex.sql",
      "checksum": "5f214f02ba0e8a5cc0ed00d16aad0b2bbe034a0da0d58dfaacd5c3abde593d2c",
      "reversible": false,
      "compatibility": "forward-only"
    },
    {
      "id": "013_seed_torrent_cache.sql",
      "checksum": "05221f5bd9ac46aef22fd98189b15278de66b4f0a4a0a05ec60ad8a20596bd8f",
      "reversible": false,
      "compatibility": "forward-only"
    },
    {
      "id": "014_seed_torrent_cache_least_privilege.sql",
      "checksum": "a0520cf894d1a7a846cbdc0424b6eb6daa33d99c224f0e9038e228ed42d996b4",
      "reversible": false,
      "compatibility": "forward-only"
    },
    {
      "id": "015_snapshot_seed_anibt_tags.sql",
      "checksum": "17b4b9c6ef5bf0d6537ebd79989fdb5d480a1068b01c7d0fae109664a358b626",
      "reversible": false,
      "compatibility": "forward-only"
    },
    {
      "id": "016_discovery_release_retention.sql",
      "checksum": "f1c8fd4ffe2adcd47cb822f1f9a98e8fe6220e6cab251cc8f4616729c96c2263",
      "reversible": false,
      "compatibility": "forward-only"
    },
    {
      "id": "017_placement_companions_reclaim_delete.sql",
      "checksum": "13357ebe7459d5cd49118f71c4c27e0f09a968566eeb6b6b6920d938fc2d0837",
      "reversible": false,
      "compatibility": "forward-only"
    },
    {
      "id": "018_tag_filters_additive.sql",
      "checksum": "d870e8d41b286108674435082a752bd3d8d8a850f0ebe287ca30323dabc599df",
      "reversible": false,
      "compatibility": "forward-only"
    },
    {
      "id": "019_maintenance_retention_resume_baseline.sql",
      "checksum": "3f147c7caacde0125b88b025a7910fe73dbd8155ae2c367f829e79ac924290ed",
      "reversible": false,
      "compatibility": "forward-only"
    },
    {
      "id": "020_parser_kind_value_checks.sql",
      "checksum": "f0e3dfc5f9c75f1ce01c5743f846aba084c10d2c8332391598b3514795cbbccb",
      "reversible": false,
      "compatibility": "forward-only"
    },
    {
      "id": "021_subscription_pending_state.sql",
      "checksum": "e5c2df18bcdbc6cac86d9b8d23062c3be79468a061b83d81008897fd28757adc",
      "reversible": false,
      "compatibility": "forward-only"
    },
    {
      "id": "022_unmanaged_overwrite.sql",
      "checksum": "c97751160bb279aaf80166ef1235a859c416474f4217a5b35bb9374f2b1ca410",
      "reversible": false,
      "compatibility": "forward-only"
    },
    {
      "id": "023_anime_metadata_year.sql",
      "checksum": "8fc143c36c63da6da9050ca54b75f638fbc1f7a7e6d606352438d6f9b5a77890",
      "reversible": false,
      "compatibility": "forward-only"
    },
    {
      "id": "024_placement_displaced.sql",
      "checksum": "0a039efe64b89f83490c85317416a659f0a80bc43ee25965c97232083d7db24f",
      "reversible": false,
      "compatibility": "forward-only"
    },
    {
      "id": "025_naming_execution_placeholders.sql",
      "checksum": "6d8633bde4fe480d14f5025e7cdb306c3b3ccd0f3584a6df6f3643d3a169abc5",
      "reversible": false,
      "compatibility": "forward-only"
    },
    {
      "id": "026_anime_metadata_release_format.sql",
      "checksum": "cc8ea4fa16aee02b4eb931d0b593b45505ebea4999fa93d8198be44ee24b0df9",
      "reversible": false,
      "compatibility": "forward-only"
    },
    {
      "id": "027_subtitle_suffix_default.sql",
      "checksum": "cbdf5329a59c1d69708365e491c7b5fd080bbbaf059e971ee5be8e3e49c9cb27",
      "reversible": false,
      "compatibility": "forward-only"
    },
    {
      "id": "028_drop_anime_metadata_release_format.sql",
      "checksum": "3c1e62e230ebdc71e0de06ab84f8b9b3c2d9ca3099e7d86755fec931e5b364db",
      "reversible": false,
      "compatibility": "forward-only"
    },
    {
      "id": "029_naming_template_library.sql",
      "checksum": "9cca58d5a8e43f1981d4d9bb07bb3559ae9d00ccabf7518c44ffc9e96b6238b5",
      "reversible": false,
      "compatibility": "forward-only"
    },
    {
      "id": "030_cleanup_group_scope_generations.sql",
      "checksum": "6dbd9dd25661b637ac10c793d72914d6432a50d79d8d4f3bd091716b8f0003c9",
      "reversible": false,
      "compatibility": "forward-only"
    },
    {
      "id": "034_download_completion_global.sql",
      "checksum": "909b651e55f067a079a90945f8fec837fae3cbb276b14103660dcf61f9eaba74",
      "reversible": false,
      "compatibility": "forward-only"
    },
    {
      "id": "035_downloader_deletion_cancels.sql",
      "checksum": "26e7594ef590602fd47d23a185ff37584951bf6a970e2d37e8b48bb436ffd93f",
      "reversible": false,
      "compatibility": "forward-only"
    },
    {
      "id": "036_managed_anime_fixed_title.sql",
      "checksum": "6bf19f1eee403c06dad9fd42ea235dea514071aae5718875ec3bf38449d6e359",
      "reversible": false,
      "compatibility": "forward-only"
    },
    {
      "id": "037_download_timeouts_global.sql",
      "checksum": "2946f0b08c7c1a297e05d2df99202a89b09f2446e082ca7fc5944aec452f90bc",
      "reversible": false,
      "compatibility": "forward-only"
    },
    {
      "id": "038_drop_backup_runs.sql",
      "checksum": "ae8eb2d90a454ac2c1e11d62c5935e88dd58d884f2e68a548b1d40700e2752f2",
      "reversible": false,
      "compatibility": "forward-only"
    },
    {
      "id": "039_path_level_publication.sql",
      "checksum": "f71cd1700f746ab021515e13fb0767a1b96ab1cc606d90fb61fd269279d1a4ff",
      "reversible": false,
      "compatibility": "forward-only"
    },
    {
      "id": "040_anibt_tag_subdimensions.sql",
      "checksum": "3feaf2a0c9afd031d1faa263c49691dcfa099ac85b16cb1caff5dc9e8b821d8f",
      "reversible": false,
      "compatibility": "forward-only"
    },
    {
      "id": "041_import_stage_retry.sql",
      "checksum": "aeb3e0bfe86d1e265b998d86b612156e66edb0f77e837e19baeb454acc83b394",
      "reversible": false,
      "compatibility": "forward-only"
    },
    {
      "id": "042_one_time_section_input.sql",
      "checksum": "10c7b6d21d35cc5c9f23f236bedd3e9db5d5532f85a4233a104574fa7b240c60",
      "reversible": false,
      "compatibility": "forward-only"
    },
    {
      "id": "043_new_releases_only.sql",
      "checksum": "3bf7a2f6d82c121df89bf6197d97bef9a97857bf3411520e1789be7dfa844355",
      "reversible": false,
      "compatibility": "forward-only"
    },
    {
      "id": "044_anime_metadata_season.sql",
      "checksum": "634e5e3959fe9d2e662adef1aa3a268ff1105c79ebee992110466ab6aee0aec1",
      "reversible": false,
      "compatibility": "forward-only"
    },
    {
      "id": "045_naming_template_body.sql",
      "checksum": "4c069b68ccb648072fb86cda25c711264d7ad62eaef6bdaad8f607ecf6b2e785",
      "reversible": false,
      "compatibility": "forward-only"
    },
    {
      "id": "046_episode_title_cache.sql",
      "checksum": "fad2f46f5ec497923c113d190f24d6e5640801860430c4ae43ae8e09440456f7",
      "reversible": false,
      "compatibility": "forward-only"
    },
    {
      "id": "047_tmdb_work_overview.sql",
      "checksum": "d3010322dc67ba8d64afe46c68e52a11be9392934f9174b22ee4848785782231",
      "reversible": false,
      "compatibility": "forward-only"
    },
    {
      "id": "048_file_success_notification_hdr.sql",
      "checksum": "be50afaffe1341e1ed95fc7af64e71322e487cc06997f72b881491f13842e7b2",
      "reversible": false,